{
  "$schema": "http://json-schema.org/draft-07/schema#",
  "$id": "dragon.schema.json",
  "title": "Dragon Dice dragon die data",
  "description": "Generated by tools/import_dragons.py from data/raw/dragons.faces.txt. Do not hand-edit. A dragon die is an element plus a form (drake or wyrm), and the form fixes all twelve faces. Only the breath effect differs by element.",
  "type": "object",
  "required": ["dragonForms", "dragons"],
  "properties": {
    "$schema": { "type": "string" },
    "_generated": { "type": "string" },
    "_comment": { "type": "string" },
    "dragonForms": {
      "type": "object",
      "additionalProperties": {
        "type": "object",
        "required": ["name", "faces"],
        "additionalProperties": false,
        "properties": {
          "name": { "type": "string" },
          "faces": {
            "type": "object",
            "description": "Keyed by the face number, 1-12. A dragon face is a fixed named ability, not a count of result icons.",
            "required": ["1", "2", "3", "4", "5", "6", "7", "8", "9", "10", "11", "12"],
            "additionalProperties": false,
            "patternProperties": {
              "^([1-9]|1[0-2])$": {
                "enum": ["JAWS", "BREATH", "CLAW", "BELLY", "WING", "TAIL", "TREASURE"]
              }
            }
          }
        }
      }
    },
    "dragons": {
      "type": "array",
      "items": {
        "type": "object",
        "required": ["id", "element", "form"],
        "additionalProperties": false,
        "properties": {
          "id": { "type": "string", "pattern": "^[a-z0-9_]+$" },
          "element": { "enum": ["air", "death", "earth", "fire", "water"] },
          "form": { "enum": ["drake", "wyrm"] }
        }
      }
    }
  }
}
